{
  "$schema": "https://json-schema.org/draft/2020-12/schema",
  "$id": "urn:intdata:schema:registry-snapshot:v1",
  "title": "RegistrySnapshotV1",
  "type": "object",
  "additionalProperties": false,
  "required": [
    "schema_version",
    "registry_id",
    "version",
    "revision",
    "generated_at",
    "trust_bundle",
    "accepted_signers",
    "modules"
  ],
  "properties": {
    "schema_version": { "const": "RegistrySnapshotV1" },
    "registry_id": { "$ref": "#/$defs/identifier" },
    "version": { "$ref": "#/$defs/version" },
    "revision": { "$ref": "#/$defs/positive_safe_integer" },
    "generated_at": { "$ref": "#/$defs/timestamp" },
    "trust_bundle": { "$ref": "#/$defs/trust_bundle_ref" },
    "accepted_signers": {
      "type": "array",
      "minItems": 4,
      "maxItems": 16,
      "items": { "$ref": "#/$defs/accepted_signer" }
    },
    "modules": {
      "type": "array",
      "maxItems": 1024,
      "items": { "$ref": "#/$defs/module_entry" }
    }
  },
  "$defs": {
    "identifier": {
      "type": "string",
      "minLength": 1,
      "maxLength": 128,
      "pattern": "^[a-z][a-z0-9]*(?:[._:-][a-z0-9]+)*$"
    },
    "version": { "type": "string", "minLength": 1, "maxLength": 64, "pattern": "^[0-9A-Za-z][0-9A-Za-z._+-]*$" },
    "sha256": { "type": "string", "pattern": "^[a-f0-9]{64}$" },
    "positive_safe_integer": { "type": "integer", "minimum": 1, "maximum": 9007199254740991 },
    "timestamp": {
      "type": "string",
      "format": "date-time",
      "pattern": "^\\d{4}-\\d{2}-\\d{2}T\\d{2}:\\d{2}:\\d{2}Z$"
    },
    "trust_bundle_ref": {
      "type": "object",
      "additionalProperties": false,
      "required": ["bundle_id", "version", "sha256"],
      "properties": {
        "bundle_id": { "$ref": "#/$defs/identifier" },
        "version": { "$ref": "#/$defs/version" },
        "sha256": { "$ref": "#/$defs/sha256" }
      }
    },
    "accepted_signer": {
      "type": "object",
      "additionalProperties": false,
      "required": ["role", "key_ids"],
      "properties": {
        "role": { "enum": ["registry", "module", "installation-actor", "scan"] },
        "key_ids": {
          "type": "array",
          "minItems": 1,
          "maxItems": 32,
          "uniqueItems": true,
          "items": { "$ref": "#/$defs/identifier" }
        }
      }
    },
    "module_entry": {
      "type": "object",
      "additionalProperties": false,
      "required": [
        "module",
        "manifest_sha256",
        "release_manifest_sha256",
        "signature_envelope_sha256"
      ],
      "properties": {
        "module": { "$ref": "urn:intdata:schema:module-manifest:v1" },
        "manifest_sha256": { "$ref": "#/$defs/sha256" },
        "release_manifest_sha256": { "$ref": "#/$defs/sha256" },
        "signature_envelope_sha256": { "$ref": "#/$defs/sha256" }
      }
    }
  }
}
