{
  "schema_version": "RegistrySnapshotV1",
  "registry_id": "intdata.registry",
  "version": "2026.08.11",
  "revision": 42,
  "generated_at": "2026-08-11T12:01:00Z",
  "trust_bundle": {
    "bundle_id": "intdata.trust",
    "version": "1.0.0",
    "sha256": "eeeeeeeeeeeeeeeeeeeeeeeeeeeeeeeeeeeeeeeeeeeeeeeeeeeeeeeeeeeeeeee"
  },
  "accepted_signers": [
    { "role": "installation-actor", "key_ids": ["key.installation"] },
    { "role": "module", "key_ids": ["key.module"] },
    { "role": "registry", "key_ids": ["key.registry"] },
    { "role": "scan", "key_ids": ["key.scan"] }
  ],
  "modules": [
    {
      "module": {
        "schema_version": "ModuleManifestV1",
        "module_id": "bridge.core",
        "version": "1.0.0",
        "provenance": {
          "repository": "https://github.com/LeoTechPro/bridge",
          "commit": "aaaaaaaaaaaaaaaaaaaaaaaaaaaaaaaaaaaaaaaa",
          "tree_sha256": "bbbbbbbbbbbbbbbbbbbbbbbbbbbbbbbbbbbbbbbbbbbbbbbbbbbbbbbbbbbbbbbb",
          "license": "MIT"
        },
        "compatibility": {
          "platform_api": "v1",
          "operating_systems": ["linux", "windows"],
          "architectures": ["amd64"]
        },
        "capabilities": {
          "provides": [
            { "capability_id": "bridge.oauth", "version_constraint": "1.0.0" }
          ],
          "requires": []
        },
        "dependencies": [],
        "conflicts": [],
        "artifacts": [
          {
            "artifact_id": "bridge.package",
            "media_type": "application/gzip",
            "sha256": "cccccccccccccccccccccccccccccccccccccccccccccccccccccccccccccccc",
            "size_bytes": "1024",
            "path": "dist/bridge-core.tar.gz"
          }
        ],
        "migrations": [],
        "routes": [],
        "web_modules": [],
        "runtime_units": [],
        "configuration_requirements": []
      },
      "manifest_sha256": "4fad5fd6f9b95f411402db5635ed7d49964d7e1a1a94311665ea116c8bce3131",
      "release_manifest_sha256": "1111111111111111111111111111111111111111111111111111111111111111",
      "signature_envelope_sha256": "2222222222222222222222222222222222222222222222222222222222222222"
    }
  ]
}
